{
  "apiVersion": "gcac.plugin-manifest/v1",
  "kind": "GcacPlugin",
  "pluginId": "fixture.device.workflow",
  "version": "1.0.0",
  "displayNameKey": "plugin.fixture.device.name",
  "publisher": "GCAC",
  "runtime": "WORKFLOW_DSL",
  "source": "BUILTIN",
  "scope": "BOTH",
  "trust": "OFFICIAL_SIGNED",
  "support": "OFFICIAL",
  "capabilities": [
    {
      "key": "device.connection.test",
      "contractVersion": "v1",
      "actionContractId": "device.connection.test.v1",
      "riskLevel": "LOW",
      "executionLocations": ["CONTROL_PLANE", "GATEWAY"]
    }
  ],
  "permissions": ["network.http"],
  "resources": {
    "workflows": {
      "device.connection.test": "workflows/test-connection.json"
    }
  }
}
